QUEST_UNUSED_20151102_002512	梅迪奥·迪耶纳之后,费雷托利山丘爬满了恶魔.{nl}去那里打败那些恶魔吧.	신수의 날 이후 페레토리 구릉은 어느샌가 마족들이 들끓는 곳이 되어 버렸지.{nl}그 곳의 마족들을 처치하게.	QUEST_UNUSED_20151022_001168	自从梅迪奥·迪耶纳以来,最为凶恶的怪物便是兽型怪物.{nl}去费雷托利山丘打败那些兽型怪物吧.	신수의 날 이후 늘어난 몬스터 중에 사람들에게 가장 피해를 주는게 야수형들이야.{nl}페레토리 구릉의 야수 몬스터를 처치하게.	캐터프랙트 마스터
QUEST_UNUSED_20151102_002513	拿着这颗宝石,去费雷托利山丘.{nl}在你伤害那些怪物后,使用宝石的力量来净化它们.{nl}然后,把他们的骨灰带回来.	이 보석을 가지고 페레토리 구릉으로 가세요.{nl}몬스터들에게 상처를 입힌 다음 보석의 힘으로 몬스터를 정화하시기 바랍니다.{nl}그러면 재가 남을텐데 그것을 가져오세요.	QUEST_UNUSED_20151022_001170	带着这颗宝石,请去费雷托利山丘.{nl}在怪物身上留下伤痕,然后使用宝石的力量来净化那些怪物.{nl}当你做到这一步时,骨灰会残留下来.请收集它们.	이 보석을 가지고 페레토리 구릉으로 가세요.{nl}몬스터들에게 상처를 입힌 다음 보석의 힘으로 몬스터를 정화하시기 바랍니다.{nl}그러면 재가 남을텐데 그것을 모아오세요.	크리비 서브 마스터
QUEST_UNUSED_20151102_002514	这充分证明了你的实力.{nl}恭喜你达到了克里维斯的最后一个等级.{nl}我希望你将继续使用你的力量来帮助那些需要帮助的人.	이것으로 당신의 실력이 입증되었군요.{nl}크리비로서 마지막 단계에 들어서신 것을 축하드립니다.{nl}앞으로도 그 힘으로 어려운 이들에게 도움을 주시기 바랍니다.	QUEST_UNUSED_20151022_001172	你的实力已经得到了证明.{nl}恭喜你进入克里维斯的最后阶段.{nl}我希望你能用你的力量帮助那些困苦的人.	이것으로 당신의 실력이 입증되었군요.{nl}크리비로서 마지막 단계에 들어서신 것을 축하드립니다.{nl}앞으로도 그 힘으로 힘겨운 이들에게 도움을 주시기 바랍니다.	크리비 서브 마스터
QUEST_UNUSED_20151102_002515	去布拉肯修道院 64_2,你会看到斯帕纳斯曼怪物.{nl}在XXX区域击败它们并把他们的角带回来给我.	고사리 수도원64_2에서 스파나스맨이란 몬스터를 마주치실 수 있을 거에요.{nl}XX지역에서 녀석을 쓰러뜨리고 녀석의 머리에 난 그 뿔을 가져다 주세요.	QUEST_UNUSED_20151022_001183	在布拉肯森林的64_2,你将能遇到一只叫斯帕纳斯曼的怪物.{nl}请带来你头上的角.	고사리 수도원64_2에서 스파나스맨이란 몬스터를 마주치실 수 있을 거에요.{nl}녀석의 머리에 난 그 뿔을 가져다 주세요.	딥디르비 서브 마스터
QUEST_UNUSED_20151102_002516	我将给予你我的能量.{nl}在费雷托里山丘使用这股能量,它将会与部分怪物的灵魂融合.	저의 기운을 당신에게 전달해 드릴 것입니다.{nl}페레토리 구릉에서 그 기운을 사용하시면 몬스터의 영혼 일부가 섞이게 됩니다.	QUEST_UNUSED_20151022_001187	我将传递我的能量给你.{nl}当你在费雷托里山丘使用那股能量时,部分怪物的灵魂将会被混合.{nl}击败那个怪物,然后吸收灵魂后再回来.	저의 기운을 당신에게 전달해 드릴 것입니다.{nl}페레토리 구릉에서 그 기운을 사용하시면 몬스터의 영혼 일부가 섞이게 됩니다.{nl}그 몬스터를 처치하시고 영혼을 흡수한 다음 돌아오세요.	사두 마스터
QUEST_UNUSED_20151102_002517	利用我传递给你的能量击败怪物,收集他们的灵魂,然后把它们带回来给我.{nl}不要寻求任何人的帮助,独自完成.	영혼이 섞인 몬스터를 처치하시고 영혼을 흡수한 다음 돌아오세요.{nl}단, 이 시험은 동료의 도움은 받으실 수 없습니다.				사두 마스터
QUEST_UNUSED_20151102_002518	看起来你已经准备好了.{nl}如果是这样,那么就去阿普西梅斯蒂十字路口,不要带着你的盾牌,击败那里的一些怪物.	준비는 된 것 같군.{nl}그렇다면 방패를 착용하지 않은 상태에서 압시메스티 교차로의 몬스터를 해치우고 와.	QUEST_UNUSED_20151022_001199	我想你已经准备好了.{nl}如果是这样,那么就在阿普西梅斯蒂十字路口,不使用盾牌击败怪物.{nl}实际上,是脱下装备直接面对怪物.	준비는 된 것 같군.{nl}그렇다면 방패를 사용하지 않고 압시메스티 교차로의 몬스터를 해치우고 와.{nl}아니, 애초에 착용하지 않은 상태에서 몬스터를 해치우고 오는 게 좋겠군.	로델레로 마스터
QUEST_UNUSED_20151102_002519	你知道这件事只能靠你自己完成,对吧?	물론 혼자서 해내야 한다는 정도는 알겠지?				로델레로 마스터
QUEST_UNUSED_20151102_002520	你现在对长矛的使用如何?{nl}如果还不错,那么就准备好成为真正的卡塔法克特.{nl}你的同伴的情况怎么样?	어때, 이제 찌른다는 게 뭔지 알겠나?{nl}그럼 진정한 캐터프랙트로 거듭나기 위한 준비를 해보세.{nl}자네 컴패니언의 상태는 양호한가?	QUEST_UNUSED_20151022_001202	怎么样,你现在明白什么是穿透攻击了吗?{nl}好的,那么我们就准备好继续到下一个阶段吧.	어때, 이제 찌른다는 게 뭔지 알겠나?{nl}그럼 다음 단계로 나아가기 위한 준비를 해보자.	캐터프랙트 마스터
QUEST_UNUSED_20151102_002521	好吧.想象你的双臂就是那把将击倒敌人的长矛.{nl}而你的双腿则是移动你四处的同伴.{nl}前往阿普西梅斯蒂十字路口,骑在你的同伴上并击败你的敌人.	좋아. 어떤 적도 꿰뚫을 수 있는 창이 자네의 팔이라고 치지.{nl}그렇다면 다리는 단연 기동력을 제공해주는 자네의 컴패니언이라고 할 수 있을걸세.{nl}컴패니언에 올라탄 채로 압시메스티 교차로의 적들을 토벌하고 오게.	QUEST_UNUSED_20151022_001203	我们假设能刺穿任何敌人的长矛就是你的手臂.{nl}我们可以说腿就是你的同伴,它们赋予你移动的能力.{nl}骑在同伴上,在阿普西梅斯蒂十字路口击败敌人.	어떤 적도 꿰뚫을 수 있는 창이 자네의 팔이라고 치지.{nl}그렇다면 다리는 단연 기동력을 제공해주는 자네의 컴패니언이라고 할 수 있을걸세.{nl}컴패니언에 올라탄 채로 압시메스티 교차로의 적들을 토벌하고 오게.	캐터프랙트 마스터
QUEST_UNUSED_20151102_002522	我收到了来自特斯拉的一封信!{nl}从他写的内容来看,他似乎对你有很大的期望.{nl}我们来看看你是否足够进步,能够不辜负他的期望.	간신히 테슬라님과 연락이 닿았어요!{nl}당신에 대해서 편지에 적었더니 기대되는 인재라고 하시더군요.{nl}지금 당신의 실력은 그 기대에 걸맞게 성장했을지 시험해보죠.	QUEST_UNUSED_20151022_001210	我几乎没能和特斯拉取得联系!{nl}我在信中提到了你,他肯定对你有很高的期望.{nl}那么,你为什么不试着挑战迪夫迪尔比斯的最后一个等级呢?	간신히 테슬라님과 연락이 닿았어요!{nl}당신에 대해서 편지에 적었더니 기대되는 인재라고 하시더군요.{nl}그런 의미에서 딥디르비의 마지막 단계에 도전해보시는 건 어떨까요?	딥디르비 서브 마스터
QUEST_UNUSED_20151102_002523	城市之间可能相距甚远,但总是有一条快速通道的.{nl}祝你好运.	두 도시 간 거리가 멀긴 하지만 언제나 빠른 방법은 있는 법이랍니다.{nl}수고해 주세요.	QUEST_UNUSED_20151022_001215	我听说可以利用女神雕像的力量轻松地前往费迪米安.{nl}这样我们就能节省一些时间.	여신상의 힘을 사용하면 페디미안까지 쉽게 이동할 수 있다고들 하네요.{nl}조금이라도 시간을 줄일 수 있겠네요.	딥디르비 서브 마스터
QUEST_UNUSED_20151102_002524	拿着这个遗物去饥饿恶魔之路.{nl}在海斯崖的废弃祭坛激活它,怪物就会出现.{nl}我假设你知道接下来该怎么做?	이 오래된 성물을 가지고 큰아귀 길로 가세요.{nl}히스 절벽에 있는 버려진 제단에 성물을 반응시키면 몬스터들이 나올 겁니다.{nl}그 다음은 말씀드리지 않아도 아시겠지요?	QUEST_UNUSED_20151022_001220	请带着这些遗物去饥饿恶魔之路.{nl}当你将这些遗物激活在上面的废弃祭坛时,怪物就会出现.{nl}即使我什么也不说,你也知道下一步该怎么做,对吧?	이 오래된 성물을 가지고 큰아귀 길로 가세요.{nl}위쪽 막다른 곳에 버려진 제단에 성물을 반응시키면 몬스터들이 나올 겁니다.{nl}그 다음은 말씀드리지 않아도 아시겠지요?	팔라딘 서브 마스터
QUEST_UNUSED_20151102_002525	被遗弃的祭坛位于希斯悬崖,在饥饿恶魔之道上.	버려진 제단은 큰아귀 길의 히스 절벽에 있습니다.	QUEST_UNUSED_20151022_001221	被遗弃的祭坛位于饥饿恶魔之道尽头的死路上.	버려진 제단은 큰아귀 길 위쪽 막다른 지점에 있습니다.	팔라딘 서브 마스터
QUEST_UNUSED_20151102_002526	做得好.你距离下一个等级又近了一步.{nl}我很愿意把你的才能介绍给我的叔叔；他正忙着作为一名大师工作.	수고하셨어요. 보다 높은 경지로 또 한 발을 내딛으셨군요.{nl}마스터로써 중요한 일로 바쁘신 저희 삼촌께도 보여드렸으면 싶은 실력이시네요.	QUEST_UNUSED_20151022_001222	干得好.你已经迈入更高的境界.{nl}你具备了我想向我的叔父(一位大师)展示的技能.	수고하셨어요. 보다 높은 경지로 또 한 발을 내딛으셨군요.{nl}마스터로써 중요 임무 중인 저희 삼촌께도 보여드렸으면 싶은 실력이시네요.	팔라딘 서브 마스터
QUEST_UNUSED_20151102_002527	最后,你现在真的是一名真正的罗德莱诺了.{nl}但是你具备成为领导者的条件吗?{nl}为什么不试着在格林庄园里的科利门西亚人中施展一下呢?	드디어 자네도 한 명의 어엿한 로델레로군.{nl}하지만 자네가 과연 남들을 이끌만한 능력이 있는가?{nl}그린가의 장원에 있는 콜리멘시아로 시험해보지.	QUEST_LV_0200_20150918_009098	如此你现在是一名合格的罗德莱诺了.{nl}但是,关于与科利门西亚人战斗……在格林家族庄园里的那一个.	드디어 자네도 한 명의 어엿한 로델레로군.{nl}하지만 콜리멘시아라면 어떨까.. 그린가의 장원에 있는 위험한 녀석 말이야.	로델레로 마스터
QUEST_UNUSED_20151102_002528	你将要感到不知所措.{nl}但是在你能够达到下一个罗德莱诺等级之前,你需要知道自己的弱点.	분명 버거움을 느낄 거야.{nl}하지만 자신의 부족함을 알아야 더 높은 경지의 로델레로가 될 수 있는 것이지.	QUEST_LV_0200_20150918_009100	你将感受到其中的一些重量.{nl}但是,你应该认识到自己的不足之处,才能成为更好的罗德莱诺.{nl}	분명 버거움을 느낄 거야.{nl}하지만 자신의 부족함을 알아야 더 높은 경지의 로델레로가 될 수 있는 것이지.{nl}	로델레로 마스터
QUEST_UNUSED_20151102_002529	与如此强大的对手战斗是什么感觉?你觉得自己适合做一名罗德莱诺吗?{nl}在我看来,你已经是一名真正的罗德莱诺了.{nl}继续努力吧.{nl}	강적과 싸워보니 어떻던가? 스스로 로델레로에 걸맞다고 생각하는가?{nl}자네가 어떻게 생각하든 내가 보기에 자네는 이미 어엿한 로델레로일세.{nl}앞으로 함께 정진해 나가세.{nl}	QUEST_LV_0200_20150918_009099	当有些东西不足时,这意味着还有改进的空间.{nl}别担心,我可以弥补这一点.	부족한 것이 있다는 건 더 나아갈 여지가 있다는 말이야.{nl}걱정 마. 내가 채워줄 수 있거든.	로델레로 마스터
QUEST_UNUSED_20151102_002530	要成为最强大的卡塔弗拉克特,你需要一个值得尊敬的对手.{nl}农场里的盖伊加拉斯以凶残和野蛮著称.{nl}去那里并击败他们其中的一些吧.	최강의 캐터프랙트를 꿈꾼다면 그에 걸맞는 상대를 꺾어봐야지.{nl}테넌츠 농장의 가이갈라스의 흉폭함은 널리 알려져 있다네. 피해자도 헤아릴 수 없다던가?{nl}냉큼 가서 녀석을 해치우고 오게.	QUEST_JOBSTEP_20150714_002786	如果你梦想成为最伟大的卡塔弗拉克特，那么你应该能够轻松击败农场里的盖伊加拉斯。{nl}如果你理解了，快点回来吧。	최강의 캐터프랙트를 꿈꾼다면 테넌츠 농장의 가이갈라스 정도는 가볍게 없앨 수 있어야지.{nl}알겠다면 어서 빨리 냉큼 다녀오게.	캐터프랙트 마스터
QUEST_UNUSED_20151102_002531	你的表现非常令人印象深刻.{nl}作为沙杜大师,我期待着你的进步.	정말 훌륭한 일을 해 주셨습니다.{nl}사두 마스터로서 당신의 성장을 기대하겠습니다.	QUEST_LV_0200_20150918_009101	你所做的一切真是令人惊叹.{nl}我期待着作为沙杜大师见证你的成长.	정말 훌륭한 일을 해 주셨습니다.{nl}사두 마스터로서 앞으로의 성장을 기대하겠습니다.	사두 마스터
QUEST_UNUSED_20151102_002532	你的进步相当显著.{nl}是时候让你接受最后阶段的测试了.{nl}我们需要一种方法来证明你的实力.	그 사이 실력이 또 일취월장하셨군요.{nl}아무래도 마지막 단계로 나아가기 위한 시험을 치르셔야겠어요.{nl}그 실력을 증명할 방법이 필요하겠군요.	QUEST_UNUSED_20151022_001223	你又有了进步.我的叔叔会感到惊讶.{nl}你应该参加测试,以便进入最后阶段.{nl}我们需要一种方法来证明你的技能.	그 사이 실력이 또 일취월장하셨군요. 이 정도라면 저희 삼촌도 놀라겠는걸요.{nl}아무래도 마지막 단계로 나아가기 위한 시험을 치르셔야겠어요.{nl}그 실력을 증명할 방법이 필요하겠군요.	팔라딘 서브 마스터
QUEST_UNUSED_20151102_002533	我想我知道一个适合的方法.{nl}人们说,租户农场里的盖加拉斯有些非常难以驯服.{nl}去那里击败一些,以确保他们不会伤害其他人.	마침 적당한 상대를 알고 있지요.{nl}테넌츠 농장에서 가이갈라스라는 몬스터가 날뛰는 모양이에요.{nl}녀석이 더 이상 사람들을 해치지 못하도록 처리해 주세요.	QUEST_UNUSED_20151022_001224	我知道一个适合你的对手,你可以和他战斗.{nl}叫做盖加拉斯的怪物正在租户农场里疯狂肆虐.	마침 적당한 상대를 알고 있지요.{nl}테넌츠 농장에서 가이갈라스라는 몬스터가 날뛰는 모양이에요.	팔라딘 서브 마스터
QUEST_UNUSED_20151102_002534	我曾担心这会不会太危险,不过看来我低估了你.{nl}你的表现非常令人印象深刻.{nl}我不认为有人会怀疑你能否成为一名高级圣骑士.	솔직히 좀 위험하지 않을까 싶었는데 제가 당신의 실력을 오판한 모양이군요.{nl}대단하세요.{nl}누구든지 당신이라면 높은 경지의 팔라딘이 될 수 있는 자격이 있음을 인정할 겁니다.	QUEST_UNUSED_20151022_001226	实际上,我以为会很危险,不过我猜想我误解了你的实力.{nl}做得好.任何人都会承认你是一名高级圣骑士.	솔직히 좀 위험하지 않을까 싶었는데 제가 당신의 실력을 오판한 모양이군요.{nl}대단하군요. 당신이라면 누구라도 가장 높은 경지의 팔라딘으로 인정할 겁니다.	팔라딘 서브 마스터
QUEST_UNUSED_20151102_002535	停.	끝				
QUEST_UNUSED_20151102_002536	开始!	진행!				계시자 미하일
QUEST_UNUSED_20151102_002537	?	진행?				마법사 멜히오라스
QUEST_UNUSED_20151102_002538	?	끝?				계시자 미하일
QUEST_UNUSED_20151102_002539	我以为我们会在这里找到泽米娜女神,但眼前却只有尸体……{nl}我从未见过这样的事.我们必须找到泽米娜.	여기라면 제미나 여신의 행방을 찾을 수 있을까 했는데 망자들만 가득하다니..{nl}이런 건 처음 봐요. 어서 제미나님을 찾아야 할 텐데요.	QUEST_UNUSED_20151001_000537	我以为能在这里找到泽米娜女神的下落,但这个地方到处都是尸体……{nl}我从未见过这样的事.我们应该赶快去找泽米娜.	여기라면 제미나 여신의 행방을 찾을 수 있을까 했는데 망자들만 가득하다니..{nl}이런 건 처음 봐요. 어서 제미나님을 찾아야 할텐데요.	보코르 유타
QUEST_UNUSED_20151102_002540	所以我们不能接近圣物……{nl}我理解为什么要将怪物和恶魔赶走,但为什么还要保护不让人类靠近,我就不清楚了.	가까이 가지도 못하게 막아 놓은 성물이라..{nl}몬스터나 마족은 이해한다 쳐도, 사람까지 막아놓는 건 이해가 안되네요.	QUEST_LV_0100_20151001_008743	连靠近都不行的圣物……{nl}我可以理解为什么要阻止怪物或恶魔接近它,但竟然连人类也不让靠近,这就不明白了.	가까히 가지도 못하게 막아 놓은 성물이라..{nl}몬스터나 마족은 이해한다 쳐도, 사람까지 막아놓는 건 이해가 안되네요.	보코르 유타
QUEST_UNUSED_20151102_002541	刚才那是什么?{nl}能够再次安全真是太好了.我几乎就要回到女神身边了.{nl}	그건 도대체 뭐였죠? {nl}무사해서 정말 다행이에요. 하마터면 여신의 품으로 갈 뻔 했네요.{nl}	QUEST_LV_0100_20151001_008771	谢谢你救了我.我差点就要去见女神了.{nl}看来说它是女神的圣物只是个谎言吧.{nl}	구해주셔서 감사해요. 하마터면 여신의 품으로 갈 뻔 했네요.{nl}역시 그게 여신의 성물이라는 건 거짓말이었나봐요.{nl}	보코르 유타
QUEST_UNUSED_20151102_002542	我应该早知道……它根本就不是女神的圣物.{nl}	역시.. 그게 여신의 성물이라는 건 거짓말이었나봐요.{nl}	QUEST_LV_0100_20151001_008772	女神的圣物不会召唤出这样的怪物.{nl}我觉得那棵真理之树骑士团有蹊跷.	여신의 성물이 저런 몬스터를 불러낼 리는 없으니까요.{nl}그 진리의 나무교단이라는 사람들도 의심스럽네요.	보코르 유타
QUEST_UNUSED_20151102_002543	我将把我的记录交给你.{nl}拿去销毁吧；只有这样,我才能得到真正的安宁.	내 이 기록을 자네에게 주겠네.{nl}자네가 책임지고 이 기록을 없애준다면 다시 편히 잠들 수 있을 것 같아.	QUEST_LV_0100_20151001_008851	我将把这份记录交给你.如果你确保销毁它,我就能再次安息了.{nl}请吧.	내 이 기록을 자네에게 주겠네.{nl}자네가 책임지고 이 기록을 없애준다면 다시 편히 잠들 수 있을 것 같네. {nl}부탁하네.	칼라일의 영혼
QUEST_UNUSED_20151102_002544	我觉得……我曾经见过你.{nl}	처음 보는 분.. 이네요.{nl}	QUEST_UNUSED_20151022_001229	什么?{nl}你把什么带来了?{nl}啊……无所谓了.如果你没事,能帮我吗?{nl}	응?{nl}이렇게 인적 드문 숲에는 어쩐 일로 오신거죠?{nl}아.. 그건 아무래도 좋아요. 괜찮으시면 절 좀 도와주시겠어요?{nl}	드루이드 레야
QUEST_UNUSED_20151102_002545	嗯……那就好.{nl}如果可以的话,你能帮我吗?{nl}	윽.. 그건 아무래도 좋아요. {nl}괜찮다면 절 도와주시겠어요?{nl}	QUEST_UNUSED_20151016_000799	我的名字叫德鲁伊·莱娅,我住在这片森林里.{nl}我追着跑掉的偷走村庄食物的雪貂来到这里.{nl}我没能找到食物,反而被雪貂攻击了.{nl}	저는 이 숲에 사는 드루이드 레야라고 해요.{nl}페릿이 마을을 습격해서 식량을 훔쳐달아나는 걸 쫓다가 여기까지 왔죠.{nl}그런데 식량도 못찾고 오히려 페릿들에게 공격당해버렸네요.{nl}	드루이드 레야
QUEST_UNUSED_20151102_002546	我追着偷走我们食物的雪貂来到这里.{nl}但是雪貂攻击了我,我没能夺回食物.{nl}	페릿이 마을의 식량을 훔쳐 달아나는 걸 쫓다가 여기까지 와버렸어요.{nl}그런데 식량을 되찾긴 커녕 오히려 페릿들에게 공격당해버렸네요.{nl}	QUEST_UNUSED_20151016_000800	我想在返回村庄之前治愈我的伤口.{nl}我们上面有种草药对治疗伤口很有效,请你带些来给我们.	마을로 돌아가기 전에 상처를 좀 추스려야할 것 같은데..{nl}저 위에 올라가면 상처에 잘 듣는 약초가 있어요. 그 약초를 좀 가져다주세요.	드루이드 레야
QUEST_UNUSED_20151102_002547	我需要一些急救来治疗我的伤口……{nl}在鲁夫达悬崖有一种草药可以止血,你能帮我取一些吗?	어떻게든 응급처치라도 하고 싶은데..{nl}르브다 절벽 쪽에 지혈에 잘 듣는 약초가 있어요. 그걸 부탁드려도 될까요?				드루이드 레야
QUEST_UNUSED_20151102_002548	雪貂可能会再次发动攻击.{nl}近来它们似乎认为森林里的所有东西都属于它们.	어쩌면 페릿들이 공격해올지도 몰라요.{nl}언젠가부터 이 숲에서 나는 모든 게 자기들 거라고 생각하는 것 같더라고요.	QUEST_UNUSED_20151016_000801	当我们采集草药时,雪貂可能会攻击我们.{nl}它们似乎认为这片森林里的所有东西都属于它们.	약초를 채집하다보면 페릿들이 공격해올지도 몰라요.{nl}언젠가부터 이 숲에서 나는 모든 게 자기꺼라고 생각하는 것 같더라구요.	드루이드 레야
QUEST_UNUSED_20151102_002549	非常感谢你的帮助.{nl}我要去休息一下,然后再回到车间里和其他人一起工作.{nl}	정말 감사해요. 제대로 구해 오셨네요.{nl}조금만 쉬었다가 마을 사람들이 있는 작업장으로 돌아 가야겠어요.{nl}	QUEST_UNUSED_20151022_001230	你们把它们带来了,谢谢.{nl}我想在村子里回报你……{nl}虽然我们村民并不真正欢迎外来者……{nl}	제대로 구해오셨네요. 고마워요.{nl}마을로 모셔가서 보답해드리고 싶지만..{nl}우리 마을 사람들은 외지인을 반기는 편이 아니라서요..{nl}	드루이드 레야
QUEST_UNUSED_20151102_002550	你告诉我,你看到了一个女孩被一个拿着斧头的恶魔追赶?{nl}那个恶魔可能是佐拉；那个女孩我不知道.{nl}	웬 소녀가 거대한 도끼를 든 마족에 쫓기는 걸 보셨다고요?{nl}마족은 마군주 자우라 같은데, 그 소녀는 저도 잘 모르겠네요.{nl}	QUEST_UNUSED_20151022_001231	在你回来的路上,你看到了拿着巨大斧头的恶魔和被恶魔追赶的女孩?{nl}拿着巨大斧头的恶魔就是魔王佐拉……{nl}启示者和那个女孩不应该相遇……这不是正常的事情……{nl}	돌아오는 길에 거대한 도끼를 든 마족과 그 마족에게 쫓기는 소녀를 보셨다구요?{nl}거대한 도끼를 든 마족이라면 마군주 자우라인데..{nl}계시자와 소녀를 만나게 해서는 안된다니.. 확실히 심상치 않은 일이네요..{nl}	드루이드 레야
QUEST_UNUSED_20151102_002551	而且他想阻止女孩与启示者相遇……?{nl}	게다가 그 소녀가 계시자와 만나게 해선 안된다니.. {nl}	QUEST_UNUSED_20151022_001232	我应该将这件事告诉村子,让村民们知道.{nl}我们不能让外来者因为村里的事而陷入危险.	이 일은 마을에 알리고 마을 사람들과 알아봐야겠어요.{nl}우리 마을 일로 외지인을 위험에 빠뜨릴 수는 없죠.	드루이드 레야
QUEST_UNUSED_20151102_002552	这听起来很可疑.{nl}我需要将这件事告诉村子.{nl}	느낌이 안 좋아요.{nl}이건 마을 사람들에게 알려야 할 것 같아요.{nl}				드루이드 레야
QUEST_UNUSED_20151102_002553	什么?{nl}你是一位启示者?{nl}	네?{nl}당신이 계시자라고요?{nl}	QUEST_UNUSED_20151022_001233	什么?你是启示者吗?{nl}如果是这样,那么你是在梦见灾难之后来到这里的吗?{nl}…… 如果是这样,你可能就是我们村子流传下来的民间故事中的启示者.{nl}	네? 당신이 계시자라고요?{nl}그렇다면 혹시 재앙의 꿈을 꾸고 이 곳으로 온건가요?{nl}..그렇다면 당신이 우리 마을에 내려오는 전승 속의 계시자일지도 모르겠어요.{nl}	드루이드 레야
QUEST_UNUSED_20151102_002554	难道你是在梦见灾祸之后来到这里的吗?{nl}	그렇다면 혹시 재앙의 꿈을 꾸고 이 곳으로 오신 건가요?{nl}	QUEST_UNUSED_20151022_001234	在我们的村子里,女神莱玛留下的预言以民间故事的形式流传下来了{nl}当村子遇到危险时,带着圣光追寻梦境的启示者{nl}是为了战胜邪恶之力并拯救村子的{nl}现在还不是时候,我们应该去村子里打探更多消息{nl}	우리 마을에는 먼 옛날 라이마 여신께서 남긴 예지가 전승으로 내려오고 있어요.{nl}마을이 위기에 처했을 때 재앙의 꿈을 쫓아온 계시자가 성스러운 빛과 함께{nl}사악한 기운을 물리치고 마을을 구할거라는 내용이죠.{nl}이럴 때가 아니에요. 얼른 마을에 가서 확실히 알아봐야겠어요.{nl}	드루이드 레야
