QUEST_UNUSED_20151022_001017	首先,有很多被污染的墓碑.{nl}我会毁掉这些,所以我希望你去破坏宇佐山的被污染墓碑.{nl}	우선 오염된 비석은 한 두개가 아니에요.{nl}저는 이걸 부숴버릴 테니, 당신은 우사스 언덕에 있는 오염된 비석을 파괴해 주세요.{nl}	QUEST_LV_0100_20151016_009637	这里有好几个被玷污的墓碑.{nl}我会毁掉这个,所以你去那里破坏那些墓碑吧.{nl}	우선 오염된 비석은 한 두개가 아니에요.{nl}저는 이걸 부숴버릴 테니, 당신은 저쪽의 오염된 비석을 파괴해 주세요.{nl}	알비나스
QUEST_UNUSED_20151022_001018	我想那个墓碑也会冒出红色能量.{nl}就像旁边的墓碑一样.这是污染的证据.	아마 그 비석도 붉은 기운을 뿜어 내고 있을 겁니다.{nl}옆에 있는 비석처럼요. 오염의 증거이지요.	QUEST_LV_0100_20151016_009638	那边的墓碑也应该是红色的.{nl}就像你旁边的墓碑一样.这是它已经被玷污的证据.	아마 저 쪽의 비석도 붉은 기운을 뿜어 내고 있을 겁니다.{nl}옆의 비석처럼요. 오염의 증거이지요.	알비나스
QUEST_UNUSED_20151022_001019	我不理解.{nl}阿尔比纳斯?你是安纳斯托斯的一员吗?{nl}这怎么可能?{nl}	기도 안 차는구먼.{nl}알비나스? 아나스토스 파의 일원이라고? {nl}그럴리가 없는데?{nl}	QUEST_LV_0100_20151016_009644	我无话可说.{nl}阿尔比纳斯?安纳斯托斯的一员?这不可能!{nl}	기도 안 차는구먼.{nl}알비나스? 아나스토스 파의 일원이라고? 그럴리가 없는데?{nl}	다미요나스
QUEST_UNUSED_20151022_001020	我不是说我认识安纳斯托斯帕所有人……{nl}但我们过去是同一个骑士团的一部分,所以我对他们很熟悉.{nl}	내가 아나스토스파의 모든 사람을 아는 건 아니지만..{nl}같은 교단 사람인지라 그들과는 원래 잘 아는 사이란 말이오.{nl}	QUEST_LV_0100_20151016_009645	把他带到我面前!{nl}我一定要亲眼见证!	그 사람을 데려오시오! {nl}당장 확인 해 봐야겠소!	다미요나스
QUEST_UNUSED_20151022_001021	不可能,把他立刻带到这里来!{nl}我一定要亲自听他解释!	안되겠어, 당장 그 사람을 데려오시오! {nl}내 직접 확인해야겠어!				다미요나스
QUEST_UNUSED_20151022_001022	当你收集足够多的石头时,去内斯托帕营地找埃迪纳斯看看{nl}他会用这些石头制作用于建筑的石料{nl}	적당한 석재를 구해서 네스토스파의 캠프에 있는 에뒤나스에게 찾아가시오.{nl}그가 복구용 석재로 다듬어 줄 거요.{nl}	QUEST_LV_0100_20151016_009648	收集一些合适的石块,然后去那边的内斯托营地找埃迪纳斯{nl}	적당한 석재를 구해서 저 쪽 네스토스 캠프에 있는 에뒤나스에게 찾아가시오.{nl}	다미요나스
QUEST_UNUSED_20151022_001023	如果埃迪纳斯发现你做了这个墓志铭,他不会高兴的{nl}如果你想承担责任,就记住这一点.	하지만 당신이 비석을 이렇게 만들었다는 걸 알면 에뒤나스가 길길이 날뛰겠지.{nl}책임을 지려면 그 정도는 감수해야 할 게요.	QUEST_LV_0100_20151016_009649	如果埃迪纳斯知道你对墓志铭做了这样的事情,他不会高兴的{nl}至少要准备好承担这件事的责任.	당신이 비석을 이렇게 만들었다는 걸 알면 에뒤나스가 길길이 날뛰겠지.{nl}책임을 지려면 그 정도는 감수하시오.	다미요나스
QUEST_UNUSED_20151022_001024	在我打磨材料的时候,我不想看到你的脸{nl}要不你去击败那些让附近变得乱七八糟的怪物吧.	자재를 다듬을 동안만이라도 당신 얼굴은 보고싶지 않네요.{nl}이 주변을 어지럽히는 몬스터나 정리해 주시던가요.	QUEST_LV_0100_20151016_009654	在我准备材料的时候,我不想看到你{nl}去清理一下周围的怪物吧.	자재를 다듬을 동안 당신 얼굴은 보고싶지 않네요.{nl}이 주변을 어지럽히는 몬스터나 정리해 주시던가요.	에뒤나스
QUEST_UNUSED_20151022_001025	既然一切都完成了,就带着这个回到达米约纳斯吧{nl}别再这样做了.	다 됐으니 이걸 가지고 다미요나스에게 돌아가 보세요.{nl}이젠 다시는, 절대로 그러지 마세요.	QUEST_LV_0100_20151016_009656	都完成了{nl}现在,别再这样做了.	다 됐네요. {nl}이젠 다시는, 절대로 그러지 마세요.	에뒤나스
QUEST_UNUSED_20151022_001026	拿着吧.现在,我将开始恢复.{nl}幸运的是,损害并不严重.	구해 왔군. 이제 복구를 시작하겠소.{nl}파손 정도가 심하지 않아서 이 정도로 끝난 게 다행이군.	QUEST_LV_0100_20151016_009657	都收集好了{nl}我们来看看能不能修好它{nl}幸亏它没有被损坏得太厉害.	구해 왔군. 이제 수리해 보세나.{nl}파손 정도가 심하지 않아서 이 정도로 끝난 게 다행이군.	다미요나스
QUEST_UNUSED_20151022_001027	我们和安纳斯帕有不同的意见,但是我们并非敌对.{nl}自从不明之名出现以来,很显然我们怀疑它.{nl}	우리와 아나스토스파와는 그저 의견이 좀 다를 뿐이지 서로를 적대시하던가 하는 일은 없소.{nl}그런데 알지도 못하는 이름이 튀어나오니 의심하는 것이 당연하지 않겠소?{nl}	QUEST_LV_0100_20151016_009658	我们和安纳斯托斯从未有过任何麻烦,只是有些意见不一致{nl}我们听到一个关于完全不知道的名字后不得不产生怀疑.	우리와 아나스토스파와는 그저 의견이 좀 다를 뿐이지 서로를 적대시하던가 하는 일은 없네.{nl}그런데 알지도 못하는 이름이 튀어나오니 의심하는 것이 당연하지 않겠나.{nl}	다미요나스
QUEST_UNUSED_20151022_001028	而且你甚至毁了墓碑.{nl}总之,由于你已经完成你的责任,我会原谅你.{nl}	게다가 힘들게 세운 비석을 부숴버렸으니 말이오.{nl}어쨌든 책임을 졌으니 일단 이 정도로 용서하겠소.{nl}	QUEST_LV_0100_20151016_009659	尤其是他们毁掉了我们辛苦打造的墓碑{nl}既然他们已经承担了责任,我们会原谅他们.	게다가 힘들게 세운 비석을 부숴버렸으니 말일세.{nl}어쨌든 책임을 졌으니 일단 이 정도로 용서하지.{nl}	다미요나스
QUEST_UNUSED_20151022_001029	难道你觉得就这样算了不公平吗?{nl}既然上面有一个阿那斯托帕的营地,去那里问问看看{nl}真是奇怪.	자네도 이대로 넘어가기엔 억울하지 않소?{nl}저 위에 아나스토스파의 캠프가 있었으니 한 번 가서 물어나 보시오.{nl}정말 이상해..	QUEST_LV_0100_20151016_009661	难道你不感到沮丧就这样离去吗?{nl}阿那斯托帕上面有他们的营地,为什么不去问问呢.这真奇怪……	자네도 이대로 넘어가기엔 억울하지 않겠나.{nl}저 위에 아나스토스파의 캠프가 있었으니 한 번 가서 물어나 보게.{nl}정말 이상해..	다미요나스
QUEST_UNUSED_20151022_001030	是啊,我是阿那斯托帕的人…… 是的,没错.{nl}是什么带你到这里来的?{nl}	예, 제가 아나스토스의.. 맞습니다.{nl}뭘 물어보러 오셨다고요?{nl}	QUEST_LV_0100_20151016_009662	是啊,阿那斯托帕的人…… 这是正确的.{nl}你来这里是为了问点什么吗?{nl}哦,不好意思,我现在有点儿心乱,所以很难回答任何问题……{nl}	예, 제가 아나스토스의.. 맞습니다.{nl}뭘 물어보러 오셨다고요?{nl}아이고, 지금 제가 정신이 없어서 뭐든 물어보셔도 답해 드리기가 좀..{nl}	게다스
QUEST_UNUSED_20151022_001031	抱歉,我现在不能回答你的问题,因为我现在很忙……{nl}如果你能找到我的研究文件,那么我或许会有空闲时间……	아이고, 지금 제가 정신이 없어서 뭐든 물어보셔도 답해 드리기가 좀..{nl}제 연구 자료를 되찾아 주시면 여유가 생길지도..	QUEST_LV_0100_20151016_009663	如果你能帮我拿到我要找的研究资料,我们可能会有转机.	제가 찾고 있는 연구 자료를 되찾아 주시면 여유가 생길지도 모르겠습니다.	게다스
QUEST_UNUSED_20151022_001032	与其盲目地追随,不如过着消灭恶魔和为混乱做准备的生活……{nl}我是指那些事儿.{nl}	여신만을 향한 맹목적인 신앙 보다는 마족 퇴치, 재앙에 대비하는 삶.. {nl}그런 것들 위주로 말이에요.{nl}	QUEST_LV_0100_20151016_009674	专注于消灭恶魔和为灾难做准备……{nl}而不仅仅是对女神们的虔诚信仰.{nl}	여신만을 향한 맹목적인 신앙 보다는 마족 퇴치, 재앙에 대비하는 삶.. {nl}그런 것들 위주로 나야가야 한다고 말입니다.{nl}	게다스
QUEST_UNUSED_20151022_001033	这确实很奇怪.{nl}我应该派一个同事去调查一下.	이건 확실히 이상해요. {nl}동료를 보내서 알아 볼 필요가 있겠어요.	QUEST_LV_0100_20151016_009675	这肯定很奇怪.{nl}我们需要派人去调查.{nl}	확실히 이상해요. {nl}이건 사람을 보내서 알아 볼 필요가 있겠어요.{nl}	게다스
QUEST_UNUSED_20151022_001034	啊,对了,我想给他一个信号弹来为任何危险做准备,但{nl}没有合适的信号弹.{nl}	아 그런데, 혹시 모를 위험에 대비해서 신호탄을 들려 보낼 건데요.{nl}적당한 게 없네요.{nl}	QUEST_LV_0100_20151016_009677	给我一些易燃粉末.{nl}找起来应该不难,因为怪物总是很多.	불에 잘 타는 가루를 구해 주세요.{nl}몬스터들은 언제나 들끓으니까, 재료를 구하는 것은 어렵지 않을 거예요.	게다스
QUEST_UNUSED_20151022_001035	你能帮我们弄到燃烧得很好的火药吗?{nl}周围有那么多怪物,所以获取材料并不难.	불에 잘 타는 가루를 구해 주실 수 있을까요?{nl}몬스터들은 언제나 들끓으니까, 재료를 구하는 것은 어렵지 않을 거예요.				게다스
QUEST_UNUSED_20151022_001036	让我们等待调查结果.{nl}他是一个有能力的小伙子,所以他很快就会查出来.	이제 조사 결과를 기다려보죠.{nl}유능한 친구이니 금방 알아올 거예요.	QUEST_LV_0100_20151016_009679	现在我们只能等待结果了.{nl}他是一个能干的人,所以不会花太长时间.	이제 조사 결과를 기다려야겠습니다.{nl}유능한 친구이니 금방 알아올 거예요.	게다스
QUEST_UNUSED_20151022_001037	既然我们不能只是站在原地不动,那么我们也一起去查个清楚吧?{nl}	그 동안 가만히 있기 뭐하니 우리도 따로 알아보도록 할까요?{nl}	QUEST_LV_0100_20151016_009680	我们可以在这期间自己进行一些调查.{nl}	그 동안 가만히 있기 뭐하니 우리도 따로 알아보지요.{nl}	게다스
QUEST_UNUSED_20151022_001038	很好.巴特可能看到了什么.{nl}她最近加入了我们的营地.{nl}	그렇지. 바르테라면 뭔가 본 게 있을 지도 몰라요.{nl}우리 캠프에 합류한 지 얼마 안되었거든요.{nl}	QUEST_LV_0100_20151016_009681	当然.巴特可能知道一些东西.{nl}他在这里没有待太久,他是一个相当博学的人.{nl}	그렇지. 바르테라면 뭔가 알고 있을지도 몰라요.{nl}우리 캠프에 합류한 지 얼마 안 된데다가 무척 박식한 청년이거든요.{nl}	게다스
QUEST_UNUSED_20151022_001039	关于阿尔比纳,你去问她好了?{nl}	그녀에게 알비나스라는 사람에 대해 물어보고 오시면 어떨까요?{nl}	QUEST_LV_0100_20151016_009682	怎么样,去问他关于那个叫阿尔比纳斯的人?{nl}	그에게 알비나스라는 사람에 대해 물어보면 어떨까요?{nl}	게다스
QUEST_UNUSED_20151022_001040	阿尔比纳斯?{nl}我在马吉瓦墓地附近看到有人和你的描述相符.{nl}	알비나스요?{nl}음.. 당신이 말한 인상착의와 비슷한 사람을 마지바 묘지에서 보긴 했어요.{nl}	QUEST_LV_0100_20151016_009685	阿尔比纳斯?{nl}嗯... 我确实看到一个人,长得很像你描述的那个样子.{nl}	알비나스요?{nl}음.. 당신이 말한 인상착의와 비슷한 사람을 보긴 했어요.{nl}	바르테
QUEST_UNUSED_20151022_001041	当你回到马吉瓦墓地时,那张皮可能还在那里.{nl}我……即使女神告诉我去,我也不能因为我太害怕了.	마지바 묘지에 다시 가면 그 가죽이 남아 있을지도 몰라요.{nl}전.. 여신께서 가라 하셔도 무서워서 도저히 못가겠네요.				바르테
QUEST_UNUSED_20151022_001042	怎么了?{nl}我想不到会有除了贝加的仆人以外的人使用那种图案.{nl}	도대체 이게 무슨 일이죠?{nl}저런 문양을 쓰는 건 바이가의 하수인 말곤 생각할 수 없어요.{nl}	QUEST_LV_0100_20151016_009696	到底发生了什么事?{nl}除了为贝加工作的人以外,没有人会使用这样的标志.{nl}	도대체 이게 무슨 일일까요.{nl}저런 문양을 쓰는 건 바이가의 하수인 말곤 생각할 수 없어요.{nl}	바르테
QUEST_UNUSED_20151022_001043	我们最好赶快通知其他人!{nl}你去告诉盖达斯!{nl}	이건 빨리 사람들에게 알려야 할 것 같아요.{nl}당신은 게다스에게 알려주세요!{nl}	QUEST_LV_0100_20151016_009697	我们必须立刻警告其他人!{nl}你去告诉盖达斯!{nl}	이건 사람들에게 알려야 될 것 같아요!{nl}당신은 게다스에게 알려주세요!{nl}	바르테
QUEST_UNUSED_20151022_001044	拜托,救救法比尤斯!{nl}啊,在此之前,我们最好回去涅斯特帕!{nl}	제발, 파비유스를 구해 주세요!{nl}아, 그 전에 네스토스파에게 들르는 게 좋겠어요!{nl}	QUEST_LV_0100_20151016_009701	我们必须让每个人都知道!{nl}拜托,通知盖达斯!{nl}	서둘러서 파비유스에게 가 주세요!{nl}아, 그 전에 네스토스파에게 들르는 게 좋겠어요!{nl}	게다스
QUEST_UNUSED_20151022_001045	这瓶圣水,请拿去.{nl}你至少会有机会在恶魔身上使用它一次.{nl}	여기 성수, 이걸 가져가세요.{nl}한 번 정도는 마족에게 크게 본때를 보일 수 있을 겁니다.	QUEST_LV_0100_20151016_009704	独自前往很危险,带上这瓶圣水.{nl}它能造成相当可怕的伤害.	여기 성수, 이걸 가져가세요.{nl}한 번 정도는 크게 한 방을 먹일 수 있을 겁니다.	에뒤나스
QUEST_UNUSED_20151022_001046	看来你是安全的.{nl}我从法比尤斯那里听说过阿尔比纳斯.{nl}	무사하셨군요.{nl}알비나스라는 사람, 아니 그 마족의 정체는 파비유스에게 들었습니다.{nl}	QUEST_LV_0100_20151016_009705	真是太好了,你是安全的.{nl}法比尤斯告诉我阿尔比纳斯的真正身份.{nl}	무사하셨군요.{nl}알비나스라는 사람, 아니 마족의 정체는 파비유스에게 다 들었습니다.{nl}	게다스
QUEST_UNUSED_20151022_001047	这样讲有道理吗?{nl}你毁坏了完好无损的墓碑却说这里没有墓碑?{nl}	그걸 지금 말이라고 하는 게요?{nl}멀쩡한 비석을 맘대로 부수고 이제와서 뭐? 없다고?{nl}	QUEST_LV_0100_20151016_009707	你现在听到自己在说什么吗?{nl}你居然有胆量毁坏石碑后还敢回来.{nl}	그걸 지금 말이라고 하는 게요?{nl}멀쩡한 비석을 맘대로 부수고 이제와서 뭐?{nl}	다미요나스
QUEST_UNUSED_20151022_001048	你想让我说什么?{nl}因为墓碑的事我头疼,所以别跟我说话.	뭘 더 말하라는 게요?{nl}비석 때문에 머리가 아프니 더 이상 말 걸지 마시오.	QUEST_LV_0100_20151016_009711	你现在又想要什么?{nl}我忙着想办法如何恢复石碑,别打扰我.	뭘 더 말하라는 게요?{nl}비석 복구할 궁리 중이니 더 말 걸지 마시오.	다미요나스
QUEST_UNUSED_20151022_001049	幸好我给你的神水对你有用了.{nl}一想到恶魔就潜伏在人类体内并使他们疏离,我就起鸡皮疙瘩.{nl}	아, 제가 드린 성수가 도움이 되었다니 정말 다행이에요.{nl}이젠 하다하다 마족이 사람 틈에 섞여서 이간질까지 하다니 정말 소름돋아요.{nl}	QUEST_LV_0100_20151016_009715	我很高兴听说我给你的圣水对你有些用处.{nl}想到恶魔就在我们中间散布并使我们分裂,真是恐怖至极.他们一定是走投无路了.{nl}	아, 제가 드린 성수가 도움이 되었다니 정말 다행이에요.{nl}이젠 하다하다 마족이 사람 속에 섞여서 이간질까지 하다니 정말 소름돋네요.{nl}	에뒤나스
QUEST_UNUSED_20151022_001050	你能告诉达米乔纳斯这件事吗?{nl}我想他们一定是在保护乌萨斯山附近那个破碎的墓碑.	다미요나스에게도 이 사실을 알려주시겠어요?{nl}아마 아직도 우사스 언덕에서 부서진 비석을 지키고 있을 겁니다.	QUEST_LV_0100_20151016_009716	你也能告诉达米乔纳斯这件事吗?{nl}他一定是在保护上次被破坏的那块石碑.	다미요나스에게도 이 사실을 알려주시겠어요?{nl}아마 저번에 부서진 비석을 지키고 있을 겁니다.	에뒤나스
QUEST_UNUSED_20151022_001051	因为有你的帮助,我才能保护住恶魔们的阴谋.{nl}我还以为我们已经分离了呢.	당신 덕분에 마족의 음모를 막을 수 있었습니다.{nl}하마터면 저희들끼리 정말 영영 갈라설 뻔 했어요.	QUEST_LV_0100_20151016_009717	多亏了你的帮助,恶魔的计划才被挫败.{nl}我们可能已经越过了永远无法回头的界限.	당신 덕분에 마족의 음모를 막을 수 있었습니다.{nl}하마터면 정말 영영 갈라설 뻔 했어요.	게다스
QUEST_UNUSED_20151022_001052	哦,对了.{nl}你有没有发现关于阿尔比纳斯的什么线索?{nl}	오, 그래. {nl}알비나스란 자에 대해 알아온 게 있소?{nl}	QUEST_LV_0100_20151016_009718	哦,不错.{nl}那么,你有没有发现关于阿尔比纳斯的什么线索?{nl}	오, 그래. {nl}알비나스란 자에 대해 알아온 게 있나?{nl}	다미요나스
QUEST_UNUSED_20151022_001053	我肯定有的人已经落入了他们的圈套.{nl}他们正在试图从内部瓦解……{nl}	분명 우리 말고도 이런 이간질에 넘어간 사람들이 있을 게요.{nl}힘으로 눌러찍는 것 뿐만 아니라 속에서부터 점점 무너뜨리려는 게지..{nl}	QUEST_LV_0100_20151016_009720	除了我们以外,一定还有其他人上过这种当.{nl}这些恶魔不仅仅是蛮横的使用暴力,还有狡猾的计划来内部瓦解我们……{nl}	분명 우리 말고도 이런 이간질에 넘어간 사람들이 있을게야.{nl}힘으로 눌러찍는 것 뿐만 아니라 속에서부터 점점 무너뜨리려는 게지..{nl}	다미요나스
QUEST_UNUSED_20151022_001054	无论如何,谢谢您.{nl}希望女神们能赐福于您.	어쨌든 시작은 사고였지만, 정말 고마웠소.{nl}여신의 가호를 빌겠소.	QUEST_LV_0100_20151016_009721	虽然最初是幸运的偶然,但是谢谢您所做的一切.{nl}愿女神陪伴在您的身边.	어쨌든 시작은 사고였지만, 정말 고마웠네.{nl}여신의 가호를 빌겠네.	다미요나스
QUEST_UNUSED_20151022_001055	阿尔比纳斯消失了!到底发生什么事了?	알비나스가 사라졌다! 무슨 일이지?	QUEST_LV_0100_20151016_009724	阿尔比纳斯不见了!到底发生什么事了?	알비나스가 사라지고 없다! 어찌 된 일일까?	PC
QUEST_UNUSED_20151022_001056	什么,您对这个启示感兴趣吗?{nl}不过,除了那些文字以外,就再没有别的了……{nl}	어라, 너 계시에 관심이 있는 거야?{nl}하지만 저 글귀 외엔 별다른 내용은 없는걸..{nl}	QUEST_LV_0200_20151016_009692	什么?您对这个启示感兴趣吗?{nl}但这里没有与之相关的任何东西……{nl}	어라, 너 계시에 관심이 있는 거야?{nl}하지만 여기엔 그거랑 관련있는 내용은 없는걸..{nl}	도굴꾼 아만다
QUEST_UNUSED_20151022_001057	首先,你引起他们的注意,正如Eminent所说的那样.{nl}同时,让我们秘密地在帕拉米索战场激活魔法圈与我一起.	우선 넌 에미넌트가 시키는 대로 해서 시선을 끌어.{nl}동시에 몰래 나랑 파라미조 격전지에서 마법진을 활성화 시키자.	QUEST_LV_0100_20151016_009772	首先,你需要遵循Eminent的命令来分散他的注意力.{nl}同时,你和我将秘密地激活魔法圈.	우선 넌 에미넌트가 시키는 대로 해서 시선을 끌어.{nl}동시에 몰래 나랑 마법진을 활성화 시키자.	도굴꾼 아만다
QUEST_UNUSED_20151022_001058	你们应该根据王国法令受到惩罚.{nl}但是,由于你们救了我们的命,而且我们有很多同事都失败了……{nl}	원칙적으론 당신들은 왕명에 의해 처벌 받아야 합니다.{nl}하지만 목숨을 구해주신데다가 많은 동료들이 낙오되었으니..{nl}	QUEST_LV_0200_20151001_009361	从原则上讲,你们应该根据王国法令受到惩罚.{nl}但是,由于你们救了我,而且我们有很多同事都失败了……{nl}	원칙적으론 당신들은 왕명으로 처벌 받아야 합니다.{nl}하지만 목숨을 구해주신데다가 많은 동료들이 낙오되었으니..{nl}	왕국군 경비병 델루스
QUEST_UNUSED_20151022_001059	我们的同事们的安全比你们的惩罚更重要.{nl}如果你们能帮助我们重新夺回总部,那么我就不会追究你们擅入这里的原因.	당신들의 처벌보단 동료들의 안전이 우선입니다.{nl}주둔지를 다시 탈환하는 걸 도와 주신다면 여기에 들어온 이유도 묻지 않고 눈감아 드리죠.	QUEST_LV_0200_20151001_009362	我们的同事们的安全比你们的惩罚更重要.{nl}如果你们帮助我们重新夺回营地,那么我们就会忘记这次惩罚的事.	당신들의 처벌보단 동료들의 안전이 우선입니다.{nl}주둔지를 다시 탈환하는 걸 도와 주신다면 눈감아 드리죠.	왕국군 경비병 델루스
QUEST_UNUSED_20151022_001060	我将利用灵魂们的记忆为您准备好魔法,您去阿塔卡侧路吧.{nl}带上您能携带的一切.{nl}	난 영혼의 기억으로 마법을 준비할 테니 자네는 아타카 샛길 쪽으로 가 보게나.{nl}떼어낼 수 있는 건 닥치는 대로 가져오게.{nl}	QUEST_LV_0100_20151016_009805	我将搜索帕拉米索战场,您走阿塔卡侧路吧.{nl}收集您能到手的一切.{nl}	난 파라미조 격전지 쪽을 찾아볼 테니 자네는 아타카 샛길 쪽으로 가 보게나.{nl}떼어낼 수 있는 건 닥치는 대로 가져오게.{nl}	프리미어 에미넌트
QUEST_UNUSED_20151022_001061	我看到了魔法阵正在活化.你还好吧?{nl}艾米内特的情况如何?{nl}	마법진들이 작동되는걸 봤어. 너 괜찮은 거 맞지? {nl}에미넌트는 어떻게 됐어?{nl}	QUEST_LV_0100_20151001_008721	我看到魔法阵激活了.你还好吗?{nl}艾米内特的情况如何?{nl}	마법진들이 작동되는걸 봤어. 너 괜찮아? {nl}에미넌트는 어떻게 됐어?{nl}	도굴꾼 아만다
QUEST_UNUSED_20151022_001062	你所问的暴君扔掉的空间很可能是……{nl}那是在卡杜梅尔时代建造的监牢.{nl}	네가 묻는 폭군이 벼려낸 참혹한 공간이라는 건 아마.. {nl}카듀멜 시대에 만들어진 감옥을 말하는 걸 거야. {nl}	QUEST_LV_0100_20151016_009820	你所说的暴君锻造的地方可能是……{nl}卡杜梅尔王朝建造的监牢.{nl}	네가 묻는 폭군이 벼려낸 참혹한 공간이라는 건 아마.. {nl}카듀멜 시대에 만들어진 감옥을 말하는 걸 꺼야. {nl}	도굴꾼 아만다
QUEST_UNUSED_20151022_001063	恢复魔法圆阵是希格斯的职责,但他受伤了,我们别无选择.{nl}此外,大家也因为寒冷而越发疲倦……我想借助你的力量.	그 마법진을 보수하는 것이 힉스의 임무였소만, 부상을 입었으니 어쩔 도리가 없지 않겠소.{nl}게다가 다들 추위에 지쳐가니.. 당신의 힘을 빌리고 싶소.	QUEST_LV_0200_20151001_009412	希格斯有责任维持魔法圆阵,但他因受伤而无法完成.{nl}此外,大家也因为寒冷而越发疲倦……我想请你来帮助我们.	그 마법진을 보수하는 것이 힉스의 임무였소만, 부상을 입었으니 어쩔 도리가 없지 않겠소.{nl}게다가 다들 추위에 지쳐가니.. 당신의 힘을 빌리고 싶구려.	메사파슬라 부대장 고먼
QUEST_UNUSED_20151022_001064	你比希格斯更出色.{nl}还能再帮我们一次吗?{nl}	우리 힉스보다 더 능숙하게 해내는군.{nl}이왕 이렇게 된 것, 한 번만 더 부탁하리다.{nl}	QUEST_LV_0200_20151001_009415	你的表现比希格斯更出色.{nl}还能再帮我们一次吗?	우리 힉스보다 더 능숙하게 해내는구려.{nl}이왕 이렇게 된 것, 한 번만 더 부탁하리다.{nl}	메사파슬라 부대장 고먼
QUEST_UNUSED_20151022_001065	我在返回时遇到了怪物.{nl}我想如果再休息一下,我就可以继续前进,但这个消息必须尽快传递过去..{nl}	서신을 가지고 복귀하던 도중 몬스터 무리를 만났죠.{nl}조금만 쉬면 금방 움직일 수 있을 것 같은데, 이 서신은 좀 급한 거라서요..{nl}	QUEST_LV_0200_20151001_009436	我返回时带着这封信,遇到了成群的怪物.{nl}我想休息一下就能恢复过来,但是必须快点送出这封信……{nl}	서신을 가지고 복귀하던 도중 몬스터 무리를 만났죠.{nl}조금만 쉬면 금방 회복할 것 같은데, 이 서신은 좀 급한 거라서요..{nl}	연락병 로체스
QUEST_UNUSED_20151022_001066	你似乎是一名合格的剑客.{nl}你有没有打算让自己达到更高的境界?	보아하니 자네도 나름 소드맨으로서 실력을 쌓은 모양이군.{nl}더 높은 경지로 가볼 생각은 없는가?				소드맨 서브 마스터
