QUEST_UNUSED_20151022_001798	特工奥温要求你击败那些扰乱特工搜索活动的怪物.	정보원 오르웬은 정보원들의 수색 활동 방해하는 몬스터들을 처치해달라고 부탁했습니다	QUEST_UNUSED_20150729_000346	进度	진행	
QUEST_UNUSED_20151022_001799	消灭魔幻阵	마족 마법진 해체				
QUEST_UNUSED_20151022_001800	奥文特工要求您解除散布在第一区和第二区的魔幻阵.	정보원 오르웬은 1/2 지역에 분포한 마족의 마법진을 해체해 달라고 부탁했습니다	QUEST_UNUSED_20150729_000346	进度	진행	
QUEST_UNUSED_20151022_001801	与诺特雷斯特工交谈	정보원 노토레스와 대화				
QUEST_UNUSED_20151022_001802	诺特雷斯特工想检查第三区是否安全,以便于即将到达奥沙的殖民者进行安全的移居.他问你那里是否能击败怪物.	정보원 노토레스는 오르샤로 몰려오는 이주민들의 안전한 이주를 위해 사전에 3번지역이 안전한지 확인해보려고 합니다. 해당 지역의 몬스터들이 처치할 수 있는 수준인지 알아봐달라고 부탁했습니다.				
QUEST_UNUSED_20151022_001803	在走廊中击败怪物	통로의 몬스터 처치	QUEST_JOBSTEP_20150323_002333	击败%s	%s 처치	
QUEST_UNUSED_20151022_001804	检查营地区域	캠프 지역 확인				
QUEST_UNUSED_20151022_001805	特工诺特雷斯想确认一下,在移民前往奥沙的同时,是否可以在第四区营地休息.让我们检查一下第四区营地是否安全.	정보원 노토레스는 이주민들이 오르샤로 향하는 동안 4번 장소의 캠프에서 쉬어도 좋을지 확인하고 싶다고 합니다. 4번 캠프 지역이 안전한지 확인해 봅시다				
QUEST_UNUSED_20151022_001806	与特工诺特雷斯交谈	정보원 노토레스와 대화하세요				
QUEST_UNUSED_20151022_001807	击败Boss怪物	보스 몬스터 처치	QUEST_JOBSTEP_20150323_002333	击败%s	%s 처치	
QUEST_UNUSED_20151022_001808	收集腐化之血	오염된 피 수집				
QUEST_UNUSED_20151022_001809	特工诺托雷斯已经告诉你,他从那些疯狂的怪物中找到了恶魔的踪迹.击败这些怪物,收集它们被污染的血液,并将其交给特工诺托雷斯.	정보원 노토레스는 광포해진 몬스터들로부터 마족의 징후를 포착했다고 합니다. 몬스터들을 처치하여 그들의 오염된 피를 수집해서 정보원 노토레스에게 전달합시다	QUEST_UNUSED_20150729_000346	进展	진행	
QUEST_UNUSED_20151022_001810	与追踪者泽加斯对话	추적자 제가우스와 대화				
QUEST_UNUSED_20151022_001811	与追迹者泽加斯对话	추적자 제가우스와 대화하세요				
QUEST_UNUSED_20151022_001812	追迹者泽加斯要求你击败周围的怪物,因为他受伤了	추적자 제가우스는 부상당한 자신들을 위해 주변 몬스터를 처치해달라고 부탁했습니다	QUEST_UNUSED_20150729_000346	进度	진행	
QUEST_UNUSED_20151022_001813	夺回追迹者们的口袋	추적자들의 주머니 회수				
QUEST_UNUSED_20151022_001814	夺回追踪者们的囊袋 Retrieve the pockets of the chasers	추적자들의 주머니 회수하세요	QUEST_UNUSED_20150729_000346	进度 Progress	진행	
QUEST_UNUSED_20151022_001815	祭司普拉纳斯正在帕普斯十字路口阿沙克地下监狱入口等待着你.	사제 프라나스가 파우피스 나루의 아샤크 지하 감옥 입구에서 당신을 기다리고 있습니다				
QUEST_UNUSED_20151022_001816	跟随祭司普拉纳斯	사제 프라나스 따라가기				
QUEST_UNUSED_20151022_001817	祭司普拉纳斯告诉你,他首先会去阿沙克地下监狱的1层.跟随祭司普拉纳斯到阿沙克地下监狱的1层.	사제 프라나스는 동료들과 함께 아샤크 지하 감옥 1층으로 먼저 진입하겠다고 말했습니다. 아샤크 지하 감옥 1층으로 사제 프라나스를 따라가세요				
QUEST_UNUSED_20151022_001818	与祭司普拉纳斯交谈	사제 프라나스와 대화와 대화하세요				
QUEST_UNUSED_20151022_001819	寻找解除诅咒图腾的方法	저주 토템을 해제할 방법 찾기				
QUEST_UNUSED_20151022_001820	祭司普拉纳斯要求你寻找解除诅咒图腾的方法	사제 프라나스는 저주 토템을 해제할 방법을 찾아달라고 부탁했습니다				
QUEST_UNUSED_20151022_001821	检查诅咒图腾	저주 토템 확인				
QUEST_UNUSED_20151022_001822	你已经在附近打败了足够多的恶魔.再次检查诅咒图腾	주변의 마족들을 충분히 처리했습니다. 저주토템을 다시 확인해 봅시다				
QUEST_UNUSED_20151022_001823	摧毁诅咒图腾	저주 토템 파괴				
QUEST_UNUSED_20151022_001824	祭司普拉纳斯要求你通过相同的手段摧毁通往乌尔波纳斯藏身处的路上设置的诅咒图腾	사제 프라나스는 같은 방식으로 우르보나스의 은거지로 가는 길에 설치되어 있는 저주 토템을 파괴해 달라고 부탁했습니다				
QUEST_UNUSED_20151022_001825	消除诅咒图腾的碎片	저주 토템 파편 제거				
QUEST_UNUSED_20151022_001826	祭司普拉纳斯要求你消除的诅咒图腾已经被某人摧毁了.但是,似乎那些碎片仍在运作中.消除诅咒图腾的碎片	사제 프라나스가 처리해달라고 부탁한 저주 토템이 이미 누군가에 의해 파괴되어 있습니다. 하지만 그 파편들이 아직 작동하는 것 같습니다. 저주 토템의 파편들을 제거하세요				
QUEST_UNUSED_20151022_001827	检查诅咒图腾	저주 토템 확인을 확인하세요				
QUEST_UNUSED_20151022_001828	击败保护图腾的首领怪物	토템을 지키는 보스몬스터 처치	QUEST_UNUSED_20150729_000346	进度	진행	
QUEST_UNUSED_20151022_001829	当你按照祭司普拉纳斯的请求毁灭诅咒图腾时,试图保护图腾的首领怪物出现了	사제 프라나스가 부탁한 저주 토템을 파괴하는 중 토템을 지키려하는 보스몬트서가 나타났습니다				
QUEST_UNUSED_20151022_001830	与乌尔波纳斯交谈	우르보나스와 대화				
QUEST_UNUSED_20151022_001831	与Urbonas交谈	우르보나스와 대화와 대화하세요				
QUEST_UNUSED_20151022_001832	Talk with 乌尔波纳斯	우르보나스와 대화하세요				
QUEST_UNUSED_20151022_001833	乌尔波纳斯主教要求你踏上魔法圈并检查是否你是真正的启示者.	주교 우르보나스는 그의 교단에서 계시자를 위해 준비한 마법진에 올라가서 계시자임을 확인해보라고 했습니다				
QUEST_UNUSED_20151022_001834	与追击者托瓦娜对话	추적자 토르바나와 대화				
QUEST_UNUSED_20151022_001835	收集赤红精髓	붉은 결정 수집				
QUEST_UNUSED_20151022_001836	追击者托瓦娜已要求您收集恶魔正使用来帮助特工的赤红精髓.	추적자 토르바나는 영주 직속 정보대원들에게 도움을 주기 위해 마족들이 사용하는 붉은 결정을 수집해달라고 부탁했습니다	QUEST_UNUSED_20150729_000346	进度	진행	
QUEST_UNUSED_20151022_001837	与追击者托瓦娜对话	추적자 토르바나와 대화와 대화하세요				
QUEST_UNUSED_20151022_001838	收集黑色木头碎片	검은 나무 조각 수집				
QUEST_UNUSED_20151022_001839	追击者托瓦娜要求你收集黑树碎片,这是情报司令部为之主人的请求.	추적자 토르바나는 영주 직속 정보대에서 의뢰한 검은 나무 조각을 수집해달라고 부탁했습니다	QUEST_UNUSED_20150729_000346	进度	진행	
QUEST_UNUSED_20151022_001840	与追击者达拉莫斯对话	추적자 다라마우스와 대화				
QUEST_UNUSED_20151022_001841	获取恶魔口袋	마족 꾸러미 습득				
QUEST_UNUSED_20151022_001842	追击者达拉莫斯告诉你,他需要调查恶魔们使用的物品.击败恶魔来获取恶魔口袋.	추적자 다라마우스는 영주 직속 정보대의 의뢰로 마족들이 사용하는 물건들을 조사해봐야 겠다고 합니다. 마족을 처치하여 마족 꾸러미를 습득하세요				
QUEST_UNUSED_20151022_001843	调查恶魔口袋	마족 꾸러미 조사				
QUEST_UNUSED_20151022_001844	正如追击者达拉莫斯所要求,你已经获得了足够数量的恶魔口袋.使用这些口袋,并将它们的效果告诉达拉莫斯.	추적자 다라마우스가 의뢰한 대로 마족 꾸러미를 충분히 모았습니다. 마족 꾸러미를 사용해보고 그 효롸를 다라마우스에게 알려줍시다				
QUEST_UNUSED_20151022_001845	与追击者达拉莫斯对话	추적자 다라마우스와 대화와 대화하세요	ETC_20150317_001977	完成	완료	
QUEST_UNUSED_20151022_001846	前往阿沙克地下监狱的第2层,沿着普拉纳斯神父的指引前进	사제 프라나스를 따라 아샤크 지하 감옥 2층으로 가세요				
QUEST_UNUSED_20151022_001847	普拉纳斯神父要求你摧毁设立在阿沙克地下监狱第2层的诅咒图腾	사제 프라나스는 아샤크 지하 감옥 2층에 설치되어 있는 저주 토템을 파괴해달라고 부탁했습니다				
QUEST_UNUSED_20151022_001848	营救伊尔玛神父	사제 이르마 구출				
QUEST_UNUSED_20151022_001849	普拉纳斯神父要求你营救被隔离在第3区的伊尔玛神父	사제 프라나스는 3번 구역에 고립된 사제 이르마를 구출해달라고 부탁했습니다				
QUEST_UNUSED_20151022_001850	与伊尔玛神父对话	사제 이르마와 대화와 대화하세요				
QUEST_UNUSED_20151022_001851	摧毁监视图腾	감시 토템 파괴				
QUEST_UNUSED_20151022_001852	伊尔玛神父想要摧毁监视图腾,并转移恶魔王马诺克斯的注意力到另一个方向,然后在阿沙克地下监狱的3层取回恶魔们写下的指示.摧毁监视图腾.	사제 이르마는 감시 토템을 파괴하여 마군주 마르녹스의 관심을 다른 곳으로 돌리고 아샤크 지하 감옥 3층의 마족 지령서를 회수하러 가자고 합니다. 감시 토템을 파괴하세요				
QUEST_UNUSED_20151022_001853	伊尔玛神父想要摧毁监视图腾,并转移恶魔王马诺克斯的注意力到另一个方向,然后在阿沙克地下监狱的3层取回恶魔们写下的指示.收集第二个监视图腾附近的不稳定恶魔石,并将它们附着在上面以摧毁它	사제 이르마는 감시 토템을 파괴하여 마군주 마르녹스의 관심을 다른 곳으로 돌리고 아샤크 지하 감옥 3층의 마족 지령서를 회수하러 가자고 합니다. 두 번째 감시토템 주변의 불안정한 마석을 수집하여 감시 토템에 부착하여 파괴하세요				
QUEST_UNUSED_20151022_001854	与盖莉雅交谈	겔리야와 대화				
QUEST_UNUSED_20151022_001855	与格丽雅交谈	겔리야와 대화와 대화하세요				
QUEST_UNUSED_20151022_001856	与神父奥拉纳斯交谈	사제 아우라나스와 대화				
QUEST_UNUSED_20151022_001857	与牧师奥拉纳斯对话	사제 아우라나스와 대화와 대화하세요				
QUEST_UNUSED_20151022_001858	收集闪亮珍珠粉末	반짝이는 진주가루 수집				
QUEST_UNUSED_20151022_001859	牧师奥拉纳斯为了满足乌尔波那斯的请求,带来了各式陷阱和物品,以便应对像今天这样的日子.奥拉纳斯告诉你,如果你能从第一区收集闪亮珍珠粉末,他将制作出对抗恶魔有用的物品.	사제 아우라나스는 우르보나스의 요청으로 오늘과 같은 일이 일어날 때를 대비하여 아샤크 지하 감옥을 맡아서 각종 함정과 물품들을 준비해 왔다고 합니다. 아우라나스가 준비해둔 반짝이는 진주가루를 1번 지역에서 수집해오면 마족들을 처리하는 데 유용한 물건을 만들어 준다고 합니다				
QUEST_UNUSED_20151022_001860	击败恶魔	마족 처리				
QUEST_UNUSED_20151022_001861	牧师奥拉纳斯告诉你,当你使用由珍珠制成的球体时,你将能够找到排名靠前的恶魔.当你使用这些球体时,你可以同时捆绑高级恶魔和下属恶魔的灵魂,如果你击败了高级恶魔,你也可以同时击败下属恶魔.	사제 아우라나스는 진주로 만든 보주를 사용하면 마족들 중에서 서열이 높은 마족을 발견할 수 있을 거라고 합니다. 진주로 만든 보주를 사용하면 서열 높은 마족과 부하 마족의 영혼을 묶을 수 있으며 서열 높은 마족을 처리하면 부하 마족도 동시에 처리할 수 있을 거라고 합니다				
QUEST_UNUSED_20151022_001862	击败高级恶魔	서열 높은 마족 처치				
QUEST_UNUSED_20151022_001863	与牧师德拉兹尼交谈	사제 드라즈니에와 대화				
QUEST_UNUSED_20151022_001864	与德拉兹尼牧师对话	사제 드라즈니에와 대화와 대화하세요				
QUEST_UNUSED_20151022_001865	德拉兹尼牧师要求你击败冲入第三区的恶魔.	사제 드라즈니에는 자신들이 은거지로 사용하던 3번 지역에 침범한 마족들을 처리해 달라고 부탁했습니다.	QUEST_UNUSED_20150729_000346	进度	진행	
QUEST_UNUSED_20151022_001866	诱惑恶魔进入陷阱	함정으로 마족 유인	QUEST_UNUSED_20150729_000346	进度: %s/%s	진행	
QUEST_UNUSED_20151022_001867	德拉兹尼神父告诉你,现在是时候使用陷阱与奥鲁纳斯神父合力了.如果你能将恶魔引诱到设在第四区毒气房间的陷阱中,你就有机会击败它们.	사제 드라즈니에는 사제 아우라나스와 준비한 함정을 사용할 때가 됐다고 합니다. 큰 노력을 들이지 않고 마족들을 4번 지역의 독방에 설치된 함정까지만 데려가면 마족들을 처리할 수 있을 거라고 합니다	QUEST_UNUSED_20150729_000346	进度:%s/%s	진행	
QUEST_UNUSED_20151022_001868	与吉莉雅神父交谈	사제 겔리야와 대화				
QUEST_UNUSED_20151022_001869	与吉莉雅牧师对话	사제 겔리야와 대화와 대화하세요				
QUEST_UNUSED_20151022_001870	伊尔玛牧师告诉你,他应该去恶魔写的指示被隐藏的地方,但是由于诅咒图腾,他没有足够的力量来念出这个咒语.摧毁诅咒图腾,帮助伊鲁玛.	사제 이르마는 마족 지령서를 숨겨둔 장소로 가야하는데 저주 토템 때문에 주문을 외울 힘이 없다고 합니다. 저주 토템을 파괴하여 이르마를 도와줍시다				
QUEST_UNUSED_20151022_001871	伊尔玛牧师请你摧毁第3区的监视图腾,以此来转移阿沙克地下监狱3层某处的马诺克斯的注意力.	사제 이르마는 아샤크 지하 감옥 3층 어딘가에 있을 마르녹스의 눈을 돌리기 위해 3번 지역의 감시 토템을 파괴해달라고 부탁했습니다				
QUEST_UNUSED_20151022_001872	与伊妮莎·哈蒙代尔交谈	이네사 해먼데일와 대화				
QUEST_UNUSED_20151022_001873	和伊妮莎·哈蒙代尔对话	이네사 해먼데일와 대화와 대화하세요				
QUEST_UNUSED_20151022_001874	牧师格利雅要求您摧毁残留在阿沙克地下监狱三楼第一区的诅咒图腾.	사제 겔리야는 아샤크 지하 감옥 3층의 1번 지역에 남아있는 저주 토템들을 파괴해달라고 부탁했습니다	QUEST_UNUSED_20150729_000346	进度	진행	
QUEST_UNUSED_20151022_001875	取回牧师的包裹	사제의 가방 회수				
QUEST_UNUSED_20151022_001876	牧师格利贾要求您取回在阿沙克地下监狱失踪的同事们的物品.	사제 겔리야는 아샤크 지하 감옥에서 행방불명된 동료들의 물품을 회수해달라고 부탁했습니다	QUEST_UNUSED_20150729_000346	进度	진행	
QUEST_UNUSED_20151022_001877	净化诅咒图腾碎片	저주 토템 조각 정화	QUEST_UNUSED_20150729_000346	进度	진행	
QUEST_UNUSED_20151022_001878	牧师洁莉雅要求你使用圣水湿润过的抑制带和被毁灭的诅咒图腾碎片,彻底消除恶魔能量.	사제 겔리야는 성수에 적신 붕대를 사용하여 파괴된 저주 토템 조각들에 사용하여 마기를 깨끗이 지워달라고 부탁했습니다	QUEST_UNUSED_20150729_000346	进度	진행	
QUEST_UNUSED_20151022_001879	与剑士副宗主交谈	소드맨 서브 마스터와 대화				
QUEST_UNUSED_20151022_001880	在奥沙与剑士副宗主交谈	오르샤에서 소드맨 서브 마스터와 대화하세요.				
QUEST_UNUSED_20151022_001881	在帕普伊斯渡口击败拉佩斯	파우피스 나루에서 라페 처치하기				
QUEST_UNUSED_20151022_001882	剑士副宗主要求在帕普伊斯渡口击败拉佩佛拉默和拉佩曼以测试启示者的能力.	소드맨 서브 마스터는 계시자의 실력을 확인하기 위해 파우피스 나루에서 라플래머와 라페먼을 처치하라고 합니다.				
QUEST_UNUSED_20151022_001883	向剑士副宗主汇报	소드맨 서브 마스터에게 보고				
QUEST_UNUSED_20151022_001884	您已经击败足够多的怪物了,回到剑士副宗主那里并汇报.	정해진 수만큼 몬스터를 처치했습니다. 소드맨 서브 마스터에게 돌아가 보고하세요.				
QUEST_UNUSED_20151022_001885	击败拉普弗拉姆	라플래머 처치				
QUEST_UNUSED_20151022_001886	击败拉普曼	라페먼 처치				
QUEST_UNUSED_20151022_001887	双手剑的可能性 [高地人进阶]	양손검의 가능성[하이랜더 전직]				
QUEST_UNUSED_20151022_001888	与高地人副大师交谈	하이랜더 서브 마스터와 대화				
QUEST_UNUSED_20151022_001889	在雷姆普拉萨池塘与高地人副大师交谈	렘파라사 연못에서 하이랜더 서브 마스터와 대화하세요.				
QUEST_UNUSED_20151022_001890	通过击打剑术练习靶证明你的实力	검 연습대를 쳐서 힘을 증명하기				
QUEST_UNUSED_20151022_001891	高地人副大师怀疑启示者是否拥有足够的力量来控制双手剑.请通过击打附近的练习桩证明你的实力.	하이랜더 서브 마스터는 계시자가 양손검을 다룰 힘이 있는지 의심하고 있습니다. 근처의 검 연습대를 상대로 그 힘을 증명하세요.				
QUEST_UNUSED_20151022_001892	前往高地人副大师处汇报	하이랜더 서브 마스터에게 보고				
QUEST_UNUSED_20151022_001893	似乎你已经展示出足够的实力了,与高地人副大师交谈吧.	이 정도면 충분히 자신의 힘을 보여준 것 같습니다. 하이랜더 서브 마스터와 다시 대화하세요.				
QUEST_UNUSED_20151022_001894	被认可为高地人,你还不够格. 再次与高地人副大师交谈.	하이랜더로 인정받기에는 아직 충분치 않은 모양입니다. 다시 하이랜더 서브 마스터와 대화하세요.				
QUEST_UNUSED_20151022_001895	在帕普伊斯十字路口击败拉普弗拉默	파우피스 나루의 라플래머를 처치하기				
QUEST_UNUSED_20151022_001896	为了评估你的实践技巧和力量,高地人副大师任务你在帕普伊斯十字路口击败拉普弗拉默.	그 힘을 실전에서 능숙하게 사용하는지를 판단하기 위해, 하이랜더 서브 마스터는 파우피스 나루의 라플래머들을 처치하고 오라고 합니다.				
QUEST_UNUSED_20151022_001897	遵照指示,你击败了拉普弗拉默.回到高地人副大师那里并汇报.	지시받은만큼 라플래머를 처치하였습니다. 하이랜더 서브 마스터에게 돌아가 보고하세요.				
QUEST_UNUSED_20151022_001898	与佩尔塔斯塔副大师交谈	펠타스타 서브 마스터와 대화				
QUEST_UNUSED_20151022_001899	与奥沙的佩尔塔斯塔副大师交谈	오르샤에서 펠타스타 서브 마스터와 대화하세요.				
QUEST_UNUSED_20151022_001900	收集拉佩曼金属装饰和木材	라페먼의 쇠장식과 쓸만한 목재 구해오기				
QUEST_UNUSED_20151022_001901	佩尔塔斯塔副大师吩咐你带来盾牌的材料.从帕普斯十字路口收集有用的树木和拉佩曼的符号.	펠타스타 서브 마스터는 방패의 재료들을 구해오라고 합니다. 파우피스 나루에서 라페먼의 쇠장식과 쓸만한 나무를 모으세요.				
QUEST_UNUSED_20151022_001902	向佩尔塔斯塔副大师报告	펠타스타 서브 마스터에게 보고				
QUEST_UNUSED_20151022_001903	看来你已经收集够了材料.回到佩尔塔斯塔副大师那里并汇报.	재료를 충분히 모은 것 같습니다. 펠타스타 서브 마스터에게 돌아가 보고하세요.				
QUEST_UNUSED_20151022_001904	从树林中找寻%s	나무 토막들을 조사해 %s 찾아내기				
QUEST_UNUSED_20151022_001905	从拉佩曼处获得%s	라페먼으로부터 %s 획득하기				
QUEST_UNUSED_20151022_001906	与奥沙的神官副长交谈	오르샤에서 클레릭 서브 마스터와 대화하세요.				
QUEST_UNUSED_20151022_001907	在联桥之森击败拉佩斯	덧댄다리 숲의 라페 처치				
QUEST_UNUSED_20151022_001908	神官副长要求您清除联桥之森中的拉佩兹和拉佩战士,让他们不再恐吓百姓.	클레릭 서브 마스터는 사람들을 괴롭히는 덧댄다리 숲의 라페자드와 라페마이터들을 소탕해 줄 것을 요청했습니다.				
QUEST_UNUSED_20151022_001909	向神官副长报告	클레릭 서브 마스터에게 보고				
QUEST_UNUSED_20151022_001910	您已经清除了足够数量的拉佩.返回向神官副长报告.	라페들을 충분히 혼내 준 듯 합니다. 클레릭 서브 마스터에게 돌아가 보고하세요.				
QUEST_UNUSED_20151022_001911	击败拉佩扎德和拉佩战士	라페자드와 라페마이터 처치				
QUEST_UNUSED_20151022_001912	向克里维斯副长交谈	크리비 서브 마스터와 대화				
QUEST_UNUSED_20151022_001913	在奥沙与克里维斯副长交谈	오르샤에서 크리비 서브 마스터와 대화하세요.				
QUEST_UNUSED_20151022_001914	猎杀怪物,填充火炬能量并点亮火炬	몬스터들을 사냥해 성화의 기운을 채우고 성화대에 불 붙이기				
QUEST_UNUSED_20151022_001915	击败怪物,注入能量到水晶中.用满水晶点亮克里维斯副长身边的火炬.	몬스터들을 처치하여 주어진 보석에 기운을 채우세요. 충만한 수정으로 크리비 서브 마스터 곁의 성화대에 불을 붙이세요.				
QUEST_UNUSED_20151022_001916	向克里维斯副长报告	크리비 서브 마스터에게 보고				
QUEST_UNUSED_20151022_001917	火炬烧得很旺.向克里维斯副长报告.	성화대가 성공적으로 타오르고 있습니다. 크리비 서브 마스터에게 보고하세요.				
QUEST_UNUSED_20151022_001918	与牧师副长交谈	프리스트 서브 마스터와 대화				
QUEST_UNUSED_20151022_001919	在奥沙与牧师副长交谈	오르샤에서 프리스트 서브 마스터와 대화하세요.				
QUEST_UNUSED_20151022_001920	从牧师克里维和博科副长那里接受祝福	클레릭, 크리비, 보코르 서브 마스터들에게 축복받기				
QUEST_UNUSED_20151022_001921	牧师副长要求您前往奥沙,向克里维和博科副长接受祝福,将圣水注入其中.	프리스트 서브 마스터는 성수에 오르샤에 있는 클레릭, 크리비, 보코르 서브 마스터들의 축복을 각각 받아오라고 합니다.				
QUEST_UNUSED_20151022_001922	向牧师副长报告	프리스트 서브 마스터에게 보고				
QUEST_UNUSED_20151022_001923	您已获得所有祝福.返回牧师副长处并汇报.	모든 축복을 받았습니다. 프리스트 서브 마스터에게 돌아가 보고하세요.				
QUEST_UNUSED_20151022_001924	在布拉肯森林63_3处击败尤格诺姆斯	고사리 숲 63_3에서 요노움 처치				
QUEST_UNUSED_20151022_001925	剑客副长要求您在布拉肯森林63_3处击败尤格诺姆斯.	소드맨 서브 마스터는 보다 강한 경지에 올라서려면 고사리 숲 63_3에서 요노움을 처치하라고 합니다.				
QUEST_UNUSED_20151022_001926	您已击败尤格诺姆斯.返回剑客副长处并报告.	정해진 요노움들을 처치했습니다. 소드맨 서브 마스터에게 돌아가 보고하세요.				
QUEST_UNUSED_20151022_001927	高地剑客副长要求您在布拉肯森林63_3处击败尤格诺姆斯,以便测试您的成长.	하이랜더 서브 마스터는 계시자가 얼마나 성장했는지 판단하기 위해 고사리 숲 63_3에서 요노움들을 처치하고 오라고 합니다.				
QUEST_UNUSED_20151022_001928	似乎已经足够了.返回高地剑客副长处并报告.	이 정도면 충분한 것 같습니다. 하이랜더 서브 마스터에게 돌아가 보고하세요.				
QUEST_UNUSED_20151022_001929	在布拉肯森林63_3处,装备盾牌击败怪物并收集精髓	방패를 착용한 상태에서 고사리 숲 63_3의 몬스터들을 처치하고 결정 모으기				
QUEST_UNUSED_20151022_001930	佩尔塔斯副长想看看你如何使用盾牌.在布拉肯森林63_3处,装备盾牌狩猎怪物并收集精髓.	펠타스타 서브 마스터는 방패의 활용능력을 보겠다고 합니다. 고사리 숲 63_3에서 방패를 착용한 채로 몬스터를 사냥하고 결정을 모으세요.				
QUEST_UNUSED_20151022_001931	您已经收集到了指定数量的精髓.返回佩尔塔斯副长处并汇报.	정해진 수의 결정을 모을 수 있었습니다. 펠타스타 서브 마스터에게 돌아가 보고하세요.				
QUEST_UNUSED_20151022_001932	在布拉肯森林63_3处击败怪物并收集%s	고사리 숲 63_3에서 몬스터들을 해치우고 %s을 모으기				
QUEST_UNUSED_20151022_001933	与奥莎城堡卫队长交谈	오르샤에서 하플라이트 마스터와 대화하세요.				
QUEST_UNUSED_20151022_001934	奥莎城堡卫队长要求您在布拉肯森林63_3处击败尤格诺姆	하플라이트 마스터는 고사리 숲 63_3에서 요노움들을 처치하고 오라고 합니다.				
QUEST_UNUSED_20151022_001935	您已击败尤格诺姆,返回奥莎城堡卫队长处报告	일정수의 요노움들을 처치하였습니다. 하플라이트 마스터에게 돌아가 보고하세요.				
